[
{"id":"A04-01","day":4,"tier":"Foundation","kind":"Architecture","tracks":["BSW & Configuration"],"question":"Explain the responsibilities of Services, ECU Abstraction and MCAL layers.","minutes":5,"answer":["Services provide OS, communication, diagnostics, memory, mode and system functions.","ECU Abstraction hides device and ECU hardware arrangement from upper layers.","MCAL provides standardized access to microcontroller peripherals.","The layering limits hardware coupling and supports reusable upper software."],"probes":["Where does an external EEPROM driver fit?","Which layer knows MCU register details?"],"refs":["AUTOSAR BSW architecture"]},
{"id":"A04-02","day":4,"tier":"Foundation","kind":"Concept","tracks":["BSW & Configuration","Workflow & ARXML"],"question":"Explain the purpose of BSW module descriptions and ECU configuration parameter definitions.","minutes":5,"answer":["Module descriptions expose capabilities, APIs, containers, parameters and dependencies.","ECUC definitions provide standardized configuration structure.","Values select project-specific instances and behavior.","Generators validate dependencies and produce implementation artifacts."],"probes":["Why can vendor extensions be needed?","What happens when definition and implementation versions differ?"],"refs":["BSW Module Description","ECUC"]},
{"id":"A04-03","day":4,"tier":"Intermediate","kind":"Configuration","tracks":["BSW & Configuration"],"question":"What makes BSW configuration difficult at system scale?","minutes":5,"answer":["Parameters are linked across modules and generated from multiple upstream models.","Timing, memory, interrupts, variants and hardware dependencies interact.","A locally valid value can violate an end-to-end system assumption.","Vendor defaults can hide architectural decisions.","Configuration must therefore be reviewed as executable architecture."],"probes":["Give one COM-to-OS dependency.","Which defaults are dangerous in safety ECUs?"],"refs":["AUTOSAR ECU Configuration"]},
{"id":"A04-04","day":4,"tier":"Intermediate","kind":"Initialization","tracks":["BSW & Configuration","SysStack"],"question":"How is BSW initialization ordered, and why do dependencies matter?","minutes":6,"answer":["Startup begins with hardware/basic initialization before higher services.","EcuM and generated initialization sequences coordinate driver, abstraction and service modules.","Modules must not access uninitialized clocks, memory or communication controllers.","Post-build data validity may affect initialization paths.","Failure handling must be defined for partial initialization."],"probes":["When can Dem be used during startup?","What if NvM read-all is delayed?"],"refs":["EcuM","BSW initialization"]},
{"id":"A04-05","day":4,"tier":"Intermediate","kind":"Design decision","tracks":["BSW & Configuration","Architecture"],"question":"When is a Complex Driver justified and how should it be governed?","minutes":6,"answer":["Use it only when standardized BSW cannot satisfy hardware, timing or legacy needs.","Define a narrow, typed interface and prevent uncontrolled application hardware access.","Analyze concurrency, interrupts, DMA, memory and safety effects.","Document portability loss and vendor ownership.","Test it as a safety-relevant architectural exception."],"probes":["Can CDD call MCAL?","How do you avoid bypassing RTE protections?"],"refs":["AUTOSAR CDD","ISO 26262-6 architecture"]},
{"id":"A04-06","day":4,"tier":"Advanced","kind":"Generation","tracks":["Toolchain & Generation","BSW & Configuration"],"question":"What should be reviewed in generated BSW code and configuration artifacts?","minutes":5,"answer":["Generator reports, warnings and unresolved defaults.","Module versions and compatibility metadata.","Memory sections, interrupt mapping and callbacks.","Configured timeouts, buffers, handles and variant selections.","Traceability from configuration to binary and regression evidence."],"probes":["Must every generated line be manually reviewed?","How do you verify generator correctness?"],"refs":["AUTOSAR generators","ISO 26262-8 tool confidence"]},
{"id":"A04-07","day":4,"tier":"Advanced","kind":"Troubleshooting","tracks":["BSW & Configuration","SysStack"],"question":"An ECU reaches main() but communication and diagnostics never become active. How do you debug it?","minutes":6,"answer":["Trace startup phases and EcuM/BswM mode transitions.","Verify clock, driver and transceiver initialization.","Inspect ComM, state-manager and network-management requests.","Check generated init lists and post-build compatibility.","Use DET/Dem traces carefully without changing timing.","Confirm application mode requests and shutdown conditions."],"probes":["What if CAN interrupts occur but no PDU reaches COM?","Where can BswM rules deadlock progress?"],"refs":["EcuM","BswM","Communication mode management"]},
{"id":"A04-08","day":4,"tier":"Advanced","kind":"Variant scenario","tracks":["BSW & Configuration","Toolchain & Generation"],"question":"How do you manage one codebase with multiple ECU hardware and vehicle variants?","minutes":6,"answer":["Separate feature, hardware and calibration variability.","Use supported configuration classes intentionally.","Define compatibility checks between executable, post-build data and hardware.","Generate and test representative or complete variant sets based on risk.","Avoid uncontrolled preprocessor forks and duplicated ARXML."],"probes":["Which parameters must remain pre-compile?","How do you validate unused combinations?"],"refs":["AUTOSAR variants","Configuration management"]},
{"id":"A04-09","day":4,"tier":"Expert","kind":"Supplier scenario","tracks":["BSW & Configuration","Safety Integration"],"question":"A BSW vendor updates MCAL and generator versions late in the program. What must be reassessed?","minutes":6,"answer":["API, configuration schema and generated artifact compatibility.","Known issues, safety manual and assumptions of use.","Compiler/linker, memory, timing and interrupt impacts.","Regression scope for drivers, communication, diagnostics and fault mechanisms.","Tool confidence and reproducibility evidence.","Release rollback and supplier defect process."],"probes":["Can version certification alone justify the update?","Which tests are target-hardware mandatory?"],"refs":["MCAL integration","ISO 26262-8 change/tool management"]},
{"id":"A04-10","day":4,"tier":"Expert","kind":"Architecture exercise","tracks":["BSW & Configuration","Safety Integration"],"question":"Define the BSW architecture for an ASIL-D braking ECU and identify modules requiring special safety attention.","minutes":7,"answer":["Map communication, system, diagnostic, memory, OS and MCAL modules to safety requirements.","Identify WdgM, E2E, OS protection, Dem, NvM integrity and hardware diagnostic mechanisms.","Control CDD and shared BSW dependencies.","Define mode transitions and safe reaction paths.","Review vendor safety manuals and project-specific assumptions.","Plan fault injection and timing evidence."],"probes":["Which BSW modules can remain QM?","How do you avoid double-counting safety mechanisms?"],"refs":["AUTOSAR BSW","ISO 26262 Parts 5/6/9"]}
]
