[
{"id":"A07-01","day":7,"tier":"Foundation","kind":"Concept","tracks":["OS"],"question":"Differentiate basic and extended AUTOSAR OS tasks.","minutes":5,"answer":["Basic tasks cannot wait for events and typically run to termination after activation.","Extended tasks can wait for events and resume when required events are set.","Both are statically configured and scheduled according to priority and conformance class.","The choice affects memory, state handling, latency and analyzability."],"probes":["Can a basic task call WaitEvent?","When is an extended task unnecessary?"],"refs":["AUTOSAR OS task model"]},
{"id":"A07-02","day":7,"tier":"Foundation","kind":"Scheduling","tracks":["OS"],"question":"Explain fixed-priority preemptive scheduling in AUTOSAR OS and the effect of task priorities.","minutes":5,"answer":["The highest-priority ready task executes, subject to configured scheduling policy and resource ceilings.","A higher-priority activation can preempt a lower-priority task.","Priorities should follow response-time needs and dependency analysis rather than runnable periods alone.","Poor priorities can cause deadline misses, starvation or priority inversion."],"probes":["Should the fastest task always have the highest priority?","How do non-preemptive tasks affect latency?"],"refs":["AUTOSAR OS scheduling"]},
{"id":"A07-03","day":7,"tier":"Intermediate","kind":"Synchronization","tracks":["OS","RTE"],"question":"How are alarms, schedule tables and events used to activate periodic and event-driven processing?","minutes":5,"answer":["Counters provide the timing base.","Alarms can activate tasks, set events or invoke configured actions.","Schedule tables coordinate multiple expiry points with defined timing relationships.","RTE runnable events are mapped onto OS mechanisms during generation.","Timing accuracy, drift and startup synchronization must be reviewed."],"probes":["When is a schedule table preferable to independent alarms?","How are network-synchronized tables handled?"],"refs":["AUTOSAR OS counters/alarms/schedule tables","RTE event mapping"]},
{"id":"A07-04","day":7,"tier":"Intermediate","kind":"Resource management","tracks":["OS","Safety Integration"],"question":"Explain AUTOSAR OS resources, the priority-ceiling protocol and priority inversion prevention.","minutes":6,"answer":["Resources serialize access to shared data or hardware.","When a task locks a resource, its effective priority rises to the configured ceiling.","This prevents unbounded priority inversion and keeps blocking analyzable.","Critical sections must remain short and follow a consistent nesting order.","RTE exclusive areas can map to OS resources or other implementation mechanisms."],"probes":["What causes deadlock?","Can an ISR use the same resource as a task?"],"refs":["AUTOSAR OS resources","RTE exclusive areas"]},
{"id":"A07-05","day":7,"tier":"Intermediate","kind":"Interrupts","tracks":["OS"],"question":"Differentiate Category 1 and Category 2 ISRs and explain their integration consequences.","minutes":5,"answer":["Category 1 ISRs are outside most OS service management and have minimal overhead.","Category 2 ISRs are managed by the OS and can use a defined subset of OS services.","ISR priority, nesting and execution time affect task response times.","Drivers often notify upper layers from ISR context or deferred task context.","Safety analysis must address interrupt storms and shared data."],"probes":["Can a Category 1 ISR activate a task?","When should processing be deferred?"],"refs":["AUTOSAR OS ISR model"]},
{"id":"A07-06","day":7,"tier":"Advanced","kind":"Protection","tracks":["OS","Safety Integration"],"question":"Explain timing protection, memory protection and OS Applications in a safety ECU.","minutes":6,"answer":["Timing protection can monitor execution budgets, arrival rates and resource lock times.","Memory protection restricts access between configured protection domains.","OS Applications group tasks, ISRs, alarms and resources into trusted or non-trusted partitions.","Protection hooks and reactions must be tied to the safety concept.","Configuration evidence must show that shared BSW and hardware paths do not defeat isolation."],"probes":["Does memory protection prove freedom from interference?","What can a protection hook safely do?"],"refs":["AUTOSAR OS protection","ISO 26262-6 freedom from interference"]},
{"id":"A07-07","day":7,"tier":"Advanced","kind":"Timing analysis","tracks":["OS","Multicore & Performance"],"question":"How do you perform response-time analysis for an AUTOSAR control task?","minutes":6,"answer":["Identify worst-case execution time, period or minimum inter-arrival time and deadline.","Add interference from higher-priority tasks and ISRs.","Include blocking from resources, non-preemptive regions and cross-core mechanisms.","Account for RTE, BSW and cache/bus effects where material.","Validate analytical assumptions using target measurements under representative worst-case load."],"probes":["Why is average CPU load insufficient?","How do diagnostic bursts enter the analysis?"],"refs":["AUTOSAR OS timing","ISO 26262 timing verification"]},
{"id":"A07-08","day":7,"tier":"Advanced","kind":"Multicore","tracks":["OS","Multicore & Performance","Safety Integration"],"question":"What new hazards and design issues arise when AUTOSAR OS is used on a multicore MCU?","minutes":6,"answer":["Cross-core data sharing, spinlocks, inter-core interrupts and startup synchronization add latency and failure paths.","Shared caches, buses, memories and peripherals create interference and dependent-failure concerns.","Core allocation must consider safety partitioning and end-to-end timing.","Global resources and spinlocks need bounded usage and ordering.","Fault containment must address a failed or overloaded core."],"probes":["Can ASIL and QM tasks simply be placed on different cores?","How do you bound spinlock time?"],"refs":["AUTOSAR OS multicore","ISO 26262 DFA/FFI"]},
{"id":"A07-09","day":7,"tier":"Expert","kind":"Design exercise","tracks":["OS","RTE","Multicore & Performance"],"question":"Derive an OS design for 1 ms brake-pressure control, 5 ms wheel-speed processing and 10 ms ESC estimation.","minutes":7,"answer":["Define runnable precedence, data-age requirements and execution budgets first.","Map the 1 ms control loop to a high-priority task with bounded inputs and outputs.","Map wheel-speed processing and estimation according to dependencies rather than only periods.","Account for sensor interrupts, communication and actuator output timing.","Define resources or RTE communication semantics to avoid inconsistent data.","Verify response times under diagnostics, bus load and fault handling."],"probes":["Would you combine the three runnables in one task?","What if the 10 ms estimator occasionally takes 4 ms?"],"refs":["AUTOSAR OS","RTE","Brake/ESC timing design"]},
{"id":"A07-10","day":7,"tier":"Expert","kind":"Failure scenario","tracks":["OS","Safety Integration"],"question":"A QM logging task causes an ASIL-D control task to miss deadlines. Analyze the architectural failure and corrective actions.","minutes":5,"answer":["The design failed to demonstrate temporal freedom from interference.","Investigate priorities, resource locks, interrupt load, memory/bus contention and logging I/O.","Partition or throttle logging and remove shared blocking paths.","Configure timing protection and define a safe reaction for deadline violations.","Update timing analysis, safety analysis and stress tests rather than only raising task priority."],"probes":["Would moving logging to another core solve it?","How should the missed deadline be detected?"],"refs":["AUTOSAR OS protection","ISO 26262-6 FFI"]}
]
