[{"id":"E02-01","day":2,"tier":"Foundation","kind":"Concept","tracks":["Processor & Memory"],"question":"Explain privilege levels, exceptions and memory protection in an embedded processor.","minutes":5,"answer":["Privilege levels restrict access to sensitive instructions and resources.","Exceptions transfer control for faults, interrupts and system calls using defined vector and state-save mechanisms.","An MPU enforces region-based access without virtual memory; an MMU translates virtual addresses and supports process isolation.","Protection design must include DMA masters and peripherals, not CPU accesses alone.","A correct design pairs protection with fault handling, logging and recovery policy."],"probes":["What happens on an illegal access?","How can DMA bypass CPU protection?","Why are default-deny regions useful?"],"refs":["Processor architecture","Memory protection"]},{"id":"E02-02","day":2,"tier":"Foundation","kind":"Concept","tracks":["Processor & Memory"],"question":"Compare cache, tightly coupled memory, SRAM, DRAM, Flash and non-volatile data storage.","minutes":5,"answer":["Cache reduces average access time but introduces variability and coherency concerns.","TCM provides predictable low-latency access for selected code or data.","SRAM is fast and deterministic but area- and cost-intensive; DRAM is denser but needs controllers and refresh.","Flash stores executable images but has erase/program constraints.","Persistent data storage requires integrity, wear, atomicity and recovery design beyond simply writing bytes."],"probes":["Where should an ISR stack live?","What data should bypass cache?","How do power failures affect persistent writes?"],"refs":["Memory hierarchy","Persistent storage"]},{"id":"E02-03","day":2,"tier":"Intermediate","kind":"Technical","tracks":["Processor & Memory","Firmware & BSP"],"question":"Design a memory map for a bootloader, application, calibration, logs and rollback image.","minutes":7,"answer":["Reserve immutable or protected boot code and metadata.","Use explicit slots for active and new images with version, size, hash and signature metadata.","Separate executable, read-only, writable, retained and shared regions with linker and protection alignment.","Define atomic update markers and rollback state that survive interrupted writes.","Leave controlled growth and manufacturing/service regions rather than consuming every address."],"probes":["How do you prevent downgrade attacks?","What must be power-fail atomic?","How are calibration compatibility rules represented?"],"refs":["Linker and memory map","Firmware update"]},{"id":"E02-04","day":2,"tier":"Advanced","kind":"Technical","tracks":["Processor & Memory","Performance & Reliability"],"question":"Explain how cache coherency and DMA can corrupt data even when the algorithm is correct.","minutes":7,"answer":["CPU caches may hold modified data not yet visible to a DMA engine.","DMA writes may not invalidate CPU cache lines, leaving stale reads.","Shared buffers require ownership transitions, alignment and cache maintenance or coherent interconnect support.","Memory barriers order accesses but do not automatically clean or invalidate caches.","The driver contract must define buffer lifetime, direction, synchronization and error handling."],"probes":["Why can volatile be insufficient?","What is false sharing?","How do IOMMUs change the risk?"],"refs":["DMA and cache coherency","Driver design"]},{"id":"E02-05","day":2,"tier":"Advanced","kind":"Debugging","tracks":["Processor & Memory","Firmware & BSP"],"question":"An interrupt fires continuously and starves the system. Describe a disciplined diagnosis.","minutes":7,"answer":["Confirm the interrupt source and vector rather than assuming the visible peripheral.","Read status and mask registers in the correct order and check level-versus-edge behavior.","Verify the handler clears the hardware condition, not only the controller pending bit.","Check shared interrupt lines, polarity, debounce and errata.","Instrument entry counts and duration, then add containment such as masking and deferred recovery."],"probes":["How can register reads have side effects?","Why does a level interrupt immediately retrigger?","When should the driver disable the device?"],"refs":["Interrupt controller","Peripheral debugging"]},{"id":"E02-06","day":2,"tier":"Expert","kind":"Architecture","tracks":["Processor & Memory","Security & Quality"],"question":"How would you isolate a third-party accelerator driver on a shared SoC?","minutes":7,"answer":["Place the driver and service in the least-privileged domain compatible with performance.","Use MMU/IOMMU mappings to constrain CPU and device DMA access.","Control command queues, firmware loading and shared buffers through validated interfaces.","Monitor timeouts, reset behavior and resource exhaustion.","Include accelerator failures in system recovery, security threat analysis and update compatibility evidence."],"probes":["Can an IOMMU prevent all accelerator attacks?","What if the firmware is signed but vulnerable?","How do you reset without corrupting clients?"],"refs":["Isolation architecture","Accelerator security"]},{"id":"E02-07","day":2,"tier":"Advanced","kind":"Technical management","tracks":["Technical Management","Processor & Memory"],"question":"A hardware vendor changes the SoC late in the program. How do you manage the impact?","minutes":7,"answer":["Establish a cross-functional impact team covering hardware, BSP, performance, safety, security, tooling and manufacturing.","Compare architectural deltas, not marketing equivalence.","Rebaseline memory, boot, driver, timing, thermal and qualification assumptions.","Prioritize risk-reduction prototypes and preserve decision evidence.","Renegotiate scope or milestones when the change invalidates committed evidence."],"probes":["Which tests run first?","How do you prevent optimistic schedule compression?","What supplier artifacts are mandatory?"],"refs":["Change management","Supplier leadership"]},{"id":"E02-08","day":2,"tier":"Advanced","kind":"Product owner scenario","tracks":["Product Ownership","Role Scenarios"],"question":"A cheaper processor reduces cost but limits graphics and future features. How should the product decision be made?","minutes":7,"answer":["Define the product horizon and feature envelope, not only the current release.","Model total cost including memory, board redesign, software optimization, certification and lost reuse.","Use representative workloads and growth headroom rather than synthetic peak numbers.","Document which future options are closed by the choice.","Make the trade-off visible to business and engineering owners with explicit assumptions."],"probes":["How much headroom is enough?","What if volumes are uncertain?","Which costs are commonly omitted?"],"refs":["Product economics","Platform roadmap"]},{"id":"E02-09","day":2,"tier":"Advanced","kind":"Engineering manager scenario","tracks":["Technical Management","Role Scenarios"],"question":"Two teams disagree on whether to use an MMU-based Linux platform or an RTOS MCU. Resolve the debate.","minutes":7,"answer":["Convert preferences into measurable requirements: deadlines, startup, isolation, update, UI, ecosystem, cost and staffing.","Identify hybrid options and system boundaries.","Prototype the highest-risk assumptions rather than debating familiar technologies.","Choose based on lifecycle and product constraints, then capture rejected alternatives.","Align staffing and ownership with the selected platform."],"probes":["What evidence would change the decision?","How do maintenance skills affect architecture?","When should both platforms coexist?"],"refs":["Platform selection","Matrix leadership"]},{"id":"E02-10","day":2,"tier":"Expert","kind":"Board exercise","tracks":["Processor & Memory","Firmware & BSP"],"question":"Create a processor, memory and peripheral architecture for a sensor-rich gateway.","minutes":7,"answer":["Allocate real-time acquisition, protocol handling, analytics and management workloads.","Define memory regions, protection domains, DMA paths and cache policy.","Specify interrupt priorities, watchdog ownership and boot dependencies.","Show how failures are contained and how software is updated.","Close with timing budgets, observability points and hardware validation needs."],"probes":["What happens during DRAM corruption?","How is a stuck DMA detected?","Which paths require deterministic memory?"],"refs":["SoC architecture","Embedded gateway"]}]
