[
{"id":"A08-01","day":8,"tier":"Foundation","kind":"Concept","tracks":["RTE"],"question":"What is the RTE, and which design decisions determine the generated RTE?","minutes":5,"answer":["RTE is the generated middleware that realizes SWC communication and access to BSW services on an ECU.","SWC ports, interfaces, internal behavior and runnable events define the application contract.","ECU allocation, communication mappings, OS/task mapping and configuration determine the concrete realization.","RTE hides local versus network implementation from application code within the limits of the interface semantics."],"probes":["Is RTE a runtime process?","Which changes force RTE regeneration?"],"refs":["AUTOSAR RTE","Software Component Template"]},
{"id":"A08-02","day":8,"tier":"Foundation","kind":"Communication semantics","tracks":["RTE"],"question":"Compare queued and unqueued sender-receiver communication.","minutes":5,"answer":["Unqueued communication exposes the latest available value and can overwrite intermediate updates.","Queued communication preserves multiple data elements in configured order until consumed or the queue overflows.","The choice affects memory, latency, loss behavior and API semantics.","Control-state values are commonly unqueued; commands or events needing every occurrence may require queues."],"probes":["How is queue overflow handled?","Would wheel speed normally be queued?"],"refs":["AUTOSAR RTE sender-receiver communication"]},
{"id":"A08-03","day":8,"tier":"Intermediate","kind":"Service invocation","tracks":["RTE"],"question":"Compare synchronous and asynchronous client-server communication and their scheduling effects.","minutes":5,"answer":["Synchronous calls block the caller until completion or configured error handling returns.","Asynchronous calls decouple request and result, usually using separate result handling or events.","Server mapping, task priority and reentrancy determine blocking and concurrency behavior.","Long or remote operations should not block safety-critical runnables without explicit timing analysis."],"probes":["Can a client-server call cross ECUs?","How is timeout represented?"],"refs":["AUTOSAR RTE client-server communication"]},
{"id":"A08-04","day":8,"tier":"Intermediate","kind":"Execution model","tracks":["RTE","OS"],"question":"Explain runnable entities, RTE events and their mapping to OS tasks.","minutes":6,"answer":["Runnable entities are executable units described in SWC internal behavior.","Timing, data-received, operation-invoked, mode and other RTE events trigger runnables.","RTE generation maps events and runnables to configured OS tasks or execution contexts.","Multiple runnables can share a task, and one runnable can have concurrency constraints.","The mapping must satisfy activation, ordering, deadline and reentrancy requirements."],"probes":["Does one runnable require one task?","What happens when two events activate the same non-reentrant runnable?"],"refs":["AUTOSAR RTE events","AUTOSAR OS mapping"]},
{"id":"A08-05","day":8,"tier":"Intermediate","kind":"Data consistency","tracks":["RTE","Safety Integration"],"question":"Differentiate implicit and explicit sender-receiver access and explain data consistency consequences.","minutes":6,"answer":["Implicit access commonly provides a consistent snapshot at runnable start and commits outputs at runnable completion.","Explicit access reads or writes when the API is called and may observe changing data during execution.","Implicit semantics simplify deterministic control calculations but require buffers and defined runnable boundaries.","Explicit semantics can reduce copying or support immediate access but need concurrency analysis.","The selection must match freshness and consistency requirements."],"probes":["Can implicit data become stale?","Which semantics suit a multi-input control calculation?"],"refs":["AUTOSAR RTE communication semantics"]},
{"id":"A08-06","day":8,"tier":"Advanced","kind":"Concurrency","tracks":["RTE","OS","Safety Integration"],"question":"How are reentrancy, exclusive areas and shared state handled in RTE-based software?","minutes":6,"answer":["Runnable concurrency is declared through internal-behavior constraints and mappings.","Exclusive areas protect shared data and can map to OS resources, interrupt suspension or implementation-specific mechanisms.","Critical sections must be bounded and analyzed for blocking and deadlock.","Per-instance memory or explicit state ownership is preferable to uncontrolled globals.","Multicore access requires additional cache, memory-ordering and cross-core protection analysis."],"probes":["Can an exclusive area span a client-server call?","How do you test race conditions in generated integration?"],"refs":["AUTOSAR RTE exclusive areas","AUTOSAR OS resources","ISO 26262 FFI"]},
{"id":"A08-07","day":8,"tier":"Advanced","kind":"Mode handling","tracks":["RTE","SysStack"],"question":"How does mode management reach an SWC through the RTE?","minutes":5,"answer":["A mode manager exposes mode declarations and switch ports.","Mode changes can be supplied by application components or BSW mode managers.","RTE propagates the mode and can trigger mode-switch events or control runnable availability.","Transitions, initialization and ambiguous concurrent mode requests require explicit ownership.","Application behavior must account for delayed or rejected transitions where relevant."],"probes":["Can BswM switch an application mode directly?","What happens to a runnable disabled by mode?"],"refs":["AUTOSAR RTE mode management","BswM"]},
{"id":"A08-08","day":8,"tier":"Advanced","kind":"Integration","tracks":["RTE","BSW & Configuration"],"question":"How do SWCs access BSW services, and what are the risks of bypassing the intended RTE interface?","minutes":5,"answer":["Service ports or standardized service interfaces allow application access through generated RTE APIs.","Some BSW interactions use configured callbacks or trusted interfaces.","Direct calls can couple applications to vendor APIs, execution context and configuration details.","Bypassing RTE can undermine portability, test doubles, protection and safety assumptions.","Exceptions require architectural justification and controlled wrappers."],"probes":["Can an SWC call Dem directly?","When is a direct CDD API acceptable?"],"refs":["AUTOSAR RTE service access","BSW interfaces"]},
{"id":"A08-09","day":8,"tier":"Expert","kind":"Troubleshooting","tracks":["RTE","Toolchain & Generation"],"question":"An SWC compiles against contract headers but fails after final RTE generation. How do you diagnose the mismatch?","minutes":6,"answer":["Compare SWC contract versions, port/interface definitions and generated API signatures.","Check ECU allocation, runnable mapping, data-type mappings and variation points.","Inspect generator diagnostics and unsupported vendor constraints.","Confirm application code did not depend on provisional naming or implementation details.","Regenerate from one controlled model baseline and add interface compatibility checks to CI."],"probes":["What if only one variant fails?","How can application teams develop before final ECU configuration?"],"refs":["RTE contract/generation phases","AUTOSAR Methodology"]},
{"id":"A08-10","day":8,"tier":"Expert","kind":"Design exercise","tracks":["RTE","OS","Safety Integration"],"question":"Design the RTE and execution model for a brake-control SWC with redundant sensor inputs, a 1 ms control runnable and a diagnostic server.","minutes":7,"answer":["Define typed sensor ports with status/freshness and consistent snapshot semantics.","Trigger the control runnable periodically and map it to a bounded high-priority task.","Separate diagnostic client-server operations from the control execution context.","Declare reentrancy, exclusive areas and per-instance state explicitly.","Map output requests with deterministic commit timing and failure reporting.","Add supervision checkpoints and verify WCET, data age, concurrency and fault paths."],"probes":["Should diagnostics read live internal state directly?","How is sensor disagreement represented?"],"refs":["AUTOSAR RTE","AUTOSAR OS","WdgM","ISO 26262-6"]}
]
