[{"id":"E07-01","day":7,"tier":"Foundation","kind":"Concept","tracks":["Connectivity & OTA"],"question":"Describe a secure OTA update lifecycle from campaign creation to field confirmation.","minutes":5,"answer":["A signed release is associated with target hardware, software dependencies and eligibility rules.","Campaign control stages rollout and monitors download, install, reboot and health status.","The device authenticates metadata and images before activation.","Rollback or recovery handles interrupted or unhealthy updates.","Post-update telemetry confirms version, health and customer impact."],"probes":["What prevents replay?","How are partial fleets handled?","When is success declared?"],"refs":["OTA lifecycle","Fleet management"]},{"id":"E07-02","day":7,"tier":"Foundation","kind":"Concept","tracks":["Connectivity & OTA","AAOS & Infotainment"],"question":"Explain major infotainment data paths: audio, graphics, vehicle signals and cloud data.","minutes":5,"answer":["Audio moves through sources, policy, mixing, processing, hardware abstraction and codecs.","Graphics traverses application, compositor, GPU and display pipeline.","Vehicle data crosses gateway, network adaptation, platform services and applications.","Cloud data passes modem, network stack, service client, storage and UI.","Each path has distinct latency, security, privacy and recovery requirements."],"probes":["Which path is hardest to debug?","Where should data be cached?","What happens when connectivity drops?"],"refs":["Infotainment architecture","Data flow"]},{"id":"E07-03","day":7,"tier":"Intermediate","kind":"Technical","tracks":["Connectivity & OTA"],"question":"Design an OTA metadata model that prevents wrong-image installation.","minutes":7,"answer":["Bind artifacts to product, hardware revision, bootloader, partition layout and dependency versions.","Include cryptographic digest, signature, size, target slot and rollback policy.","Represent preconditions, migration steps and post-install health criteria.","Make metadata itself authenticated and versioned.","Validate compatibility on the backend and again on the device."],"probes":["How do you handle optional components?","What if backend inventory is stale?","Which checks must remain device-local?"],"refs":["OTA metadata","Compatibility"]},{"id":"E07-04","day":7,"tier":"Advanced","kind":"Technical","tracks":["Connectivity & OTA","Performance & Reliability"],"question":"An audio stream glitches only during cellular handover. How do you investigate cross-domain interference?","minutes":7,"answer":["Correlate modem, kernel networking, CPU frequency, audio buffer and scheduler traces.","Check interrupt load, DMA and memory-bandwidth contention.","Measure buffer occupancy and underrun timing.","Inspect power-management and thermal transitions triggered by the modem.","Fix resource isolation or buffering based on the proven contention path."],"probes":["Why might packet loss be irrelevant?","What shared hardware can couple modem and audio?","How much buffering is acceptable?"],"refs":["Infotainment performance","Cross-domain debugging"]},{"id":"E07-05","day":7,"tier":"Advanced","kind":"Debugging","tracks":["Connectivity & OTA"],"question":"A fleet update stalls at 60% on one hardware variant. What evidence and containment do you need?","minutes":7,"answer":["Segment failures by hardware, software, geography, network and update phase.","Collect signed device state, storage health, logs and last successful checkpoint.","Pause the affected cohort while keeping unrelated cohorts controlled.","Reproduce with the exact partition and bootloader configuration.","Define recovery instructions and customer communication before resuming rollout."],"probes":["How do you distinguish download from install failure?","When should the global campaign stop?","How is telemetry trusted?"],"refs":["OTA operations","Incident response"]},{"id":"E07-06","day":7,"tier":"Expert","kind":"Architecture","tracks":["Connectivity & OTA","Security & Quality"],"question":"Design a connectivity boundary between vehicle networks, infotainment and cloud.","minutes":7,"answer":["Use a gateway with explicit allowlisted data and command contracts.","Separate trust domains and authenticate endpoints and messages.","Rate-limit and validate commands before reaching control networks.","Minimize exposed vehicle data and enforce purpose, consent and retention.","Monitor anomalies and design safe behavior during cloud or gateway compromise."],"probes":["Can TLS alone secure the architecture?","Who authorizes remote commands?","How is a compromised infotainment domain contained?"],"refs":["Connected vehicle security","Gateway architecture"]},{"id":"E07-07","day":7,"tier":"Advanced","kind":"Technical management","tracks":["Technical Management","Connectivity & OTA"],"question":"How do you prepare an organization for its first large-scale OTA campaign?","minutes":7,"answer":["Establish release authority, incident command and stop/rollback criteria.","Validate backend, device, support and service workflows together.","Run internal, employee and small-customer rings before broad rollout.","Create dashboards that distinguish campaign progress from device health.","Practice failure scenarios and customer communication before launch."],"probes":["Who can halt a campaign?","What must customer support see?","How are regional constraints handled?"],"refs":["Release operations","Organizational readiness"]},{"id":"E07-08","day":7,"tier":"Advanced","kind":"Product owner scenario","tracks":["Product Ownership","Role Scenarios"],"question":"Customers want faster feature delivery, but OTA risk grows with release frequency. How do you shape the roadmap?","minutes":7,"answer":["Decouple components and reduce blast radius through independent update units.","Invest in automated qualification, staged rollout and observability.","Classify updates by risk and required evidence.","Use feature flags and server-side control where appropriate without bypassing device safety.","Make platform investments part of product value because they enable sustainable cadence."],"probes":["Which updates require vehicle downtime?","How do you measure release confidence?","When is a feature flag dangerous?"],"refs":["Product release strategy","OTA cadence"]},{"id":"E07-09","day":7,"tier":"Advanced","kind":"Engineering manager scenario","tracks":["Technical Management","Role Scenarios"],"question":"A cloud team changes an API and breaks deployed embedded clients. How do you prevent recurrence?","minutes":7,"answer":["Define versioned contracts and compatibility ownership across cloud and device lifecycles.","Maintain representative old clients in contract tests.","Use additive evolution, capability negotiation and deprecation windows.","Require rollout sequencing and rollback plans for cross-domain changes.","Escalate when cloud release practices ignore long-lived device constraints."],"probes":["How long must old APIs live?","What if devices cannot be updated?","Who owns compatibility tests?"],"refs":["Cross-domain leadership","API lifecycle"]},{"id":"E07-10","day":7,"tier":"Expert","kind":"Board exercise","tracks":["Connectivity & OTA","Product Ownership"],"question":"Design a globally deployable connected feature with OTA, privacy and degraded operation.","minutes":7,"answer":["Define customer value, data flows, regional constraints and offline behavior.","Specify device, cloud, gateway and UI responsibilities.","Design identity, authorization, update, rollback and observability.","Create acceptance criteria for latency, availability, privacy and field support.","Present rollout strategy, major dependencies and business/technical trade-offs."],"probes":["What works with no cloud?","How is consent revoked?","Which failure triggers customer notification?"],"refs":["Connected product architecture","Global product delivery"]}]
