[
{"id":"A10-01","day":10,"tier":"Advanced","kind":"Architecture","tracks":["Architecture","Communication Stack","SysStack","OS","RTE"],"question":"Design an AUTOSAR Classic software architecture for an ESC ECU from vehicle interfaces to hardware.","minutes":6,"answer":["Define SWCs for acquisition/validation, estimation, control, arbitration, actuator output and diagnostics.","Use typed ports with timing and quality semantics.","Map communication through RTE, COM, PduR, CanIf and MCAL.","Define OS task/runnable scheduling and SysStack mode/supervision services.","Map hardware access through standard drivers or narrowly justified CDDs.","Explain startup, degraded behavior and verification boundaries."],"probes":["Where does actuator arbitration live?","How do you handle local versus remote sensors?"],"refs":["AUTOSAR Classic architecture","ESC domain architecture"]},
{"id":"A10-02","day":10,"tier":"Advanced","kind":"Safety mapping","tracks":["Safety Integration","Architecture"],"question":"How do ISO 26262 safety requirements map into an AUTOSAR architecture?","minutes":6,"answer":["Technical and software safety requirements are allocated to SWCs, RTE/OS, BSW, MCAL, hardware and interfaces.","AUTOSAR mechanisms such as E2E, WdgM, OS protection, Dem and mode management can implement parts of the safety concept.","Each mechanism needs project-specific configuration, timing and coverage evidence.","Safety requirements remain traceable to tests and analyses; AUTOSAR module compliance is not the top-level claim.","Vendor assumptions and shared-module dependencies are explicitly assessed."],"probes":["Where is FTTI represented?","Can a QM COM module carry ASIL-D data?"],"refs":["ISO 26262 Parts 4/6/8/9","AUTOSAR safety mechanisms"]},
{"id":"A10-03","day":10,"tier":"Advanced","kind":"Freedom from interference","tracks":["Safety Integration","OS","RTE","Multicore & Performance"],"question":"Build a freedom-from-interference argument for ASIL and QM software on one AUTOSAR ECU.","minutes":6,"answer":["Identify memory, timing, execution and communication interference channels.","Use MPU/OS Applications, controlled scheduling, timing protection and bounded resources.","Control RTE/BSW shared buffers, callbacks and service execution.","Analyze multicore caches, buses, DMA and peripherals.","Define monitoring and reaction to partition violations.","Verify through analysis, stress, fault injection and target evidence."],"probes":["Does separate OS Application allocation suffice?","How do shared BSW modules enter the argument?"],"refs":["AUTOSAR OS protection","ISO 26262-6 FFI"]},
{"id":"A10-04","day":10,"tier":"Advanced","kind":"Safety communication","tracks":["Safety Integration","Communication Stack"],"question":"Build a safety communication concept for brake-torque requests across ECUs.","minutes":6,"answer":["Define sender authority, receiver acceptance and arbitration responsibilities.","Specify physical range, quality, freshness, sequence and timeout semantics.","Select an E2E profile and protect at the true safety endpoints.","Budget sender execution, bus transfer and receiver reaction within FTTI.","Define behavior for loss, corruption, replay, bus-off and recovery.","Validate fault handling at network and vehicle level."],"probes":["Can a gateway recalculate the E2E CRC?","What happens to a late but valid request?"],"refs":["AUTOSAR E2E/COM stack","ISO 26262 communication safety"]},
{"id":"A10-05","day":10,"tier":"Advanced","kind":"Mechanism review","tracks":["Safety Integration","SysStack","BSW & Configuration"],"question":"Which AUTOSAR modules commonly contribute to software and hardware fault detection in a safety ECU?","minutes":5,"answer":["WdgM supervises control flow and timing checkpoints.","E2E and COM monitoring support communication fault detection.","OS protection detects timing, memory and execution violations.","Dem records diagnostic events; FiM coordinates inhibition after status qualification.","MCAL and safety libraries expose MCU/peripheral diagnostics.","Application monitors remain necessary for semantic and control faults."],"probes":["Which module detects a plausible-but-wrong torque request?","How do you avoid double-counting diagnostic coverage?"],"refs":["WdgM","E2E","AUTOSAR OS","Dem/FiM","ISO 26262 safety analysis"]},
{"id":"A10-06","day":10,"tier":"Expert","kind":"Supplier integration","tracks":["Safety Integration","BSW & Configuration"],"question":"How do you integrate a third-party AUTOSAR stack or MCAL delivered as a safety element out of context?","minutes":6,"answer":["Review safety manual, supported ASIL capability, configuration constraints and assumptions of use.","Map supplier safety requirements and mechanisms into the ECU safety architecture.","Verify tool, compiler, MCU, clock, interrupt and diagnostic assumptions.","Assess shared module and dependent-failure effects.","Execute integration verification and fault injection in the real configuration.","Track deviations and supplier responsibilities through the DIA."],"probes":["Does a certificate remove source-code review needs?","What if one assumption cannot be met?"],"refs":["ISO 26262 SEooC/AoU/DIA","AUTOSAR vendor safety manuals"]},
{"id":"A10-07","day":10,"tier":"Expert","kind":"Tool confidence","tracks":["Toolchain & Generation","Safety Integration"],"question":"How would you establish confidence in AUTOSAR configuration and code-generation tools for a safety project?","minutes":6,"answer":["Determine whether a tool error can introduce or fail to detect an error in a safety work product.","Consider downstream verification capable of detecting erroneous output.","Establish tool confidence level and qualification measures where required.","Control tool versions, settings, plugins and known issues.","Use validation, deterministic generation, generated-code checks and representative qualification cases.","Document usage constraints and evidence in the safety plan."],"probes":["Does reviewing generated code eliminate qualification?","How are cloud-based generators controlled?"],"refs":["ISO 26262-8 Clause 11","AUTOSAR generation tools"]},
{"id":"A10-08","day":10,"tier":"Expert","kind":"Leadership","tracks":["Workflow & ARXML","Safety Integration"],"question":"Define responsibilities among OEM, Tier-1, application supplier, BSW vendor and tool vendor in an AUTOSAR program.","minutes":6,"answer":["OEM owns vehicle/system intent, network/system descriptions and integration expectations.","Tier-1 owns ECU architecture, configuration integration, verification and supplier coordination unless agreed otherwise.","Application suppliers own SWC contracts, implementation and evidence.","BSW/MCAL vendors own compliant implementation, releases, constraints and safety documentation.","Tool vendors own tool behavior and qualification support.","DIA and model ownership rules must define handovers, changes, defects and acceptance."],"probes":["Who owns the ECU Extract?","Who approves a vendor extension?"],"refs":["AUTOSAR Methodology","ISO 26262-8 distributed development"]},
{"id":"A10-09","day":10,"tier":"Expert","kind":"Migration strategy","tracks":["Architecture","Toolchain & Generation","Safety Integration"],"question":"Plan migration of a mature non-AUTOSAR brake ECU to AUTOSAR Classic without a big-bang rewrite.","minutes":6,"answer":["Baseline current functional, timing, diagnostic and safety behavior.","Create stable application interfaces and isolate hardware/platform dependencies.","Introduce AUTOSAR incrementally around communication, diagnostics and hardware abstraction.","Use controlled wrappers or CDDs for legacy code while reducing them over time.","Preserve proven behavior and compare outputs through back-to-back tests.","Rebuild traceability, timing and safety evidence for each migrated boundary."],"probes":["Which layer should migrate first?","When should legacy code remain untouched?"],"refs":["AUTOSAR migration architecture","ISO 26262 reuse/change analysis"]},
{"id":"A10-10","day":10,"tier":"Expert","kind":"Board interview","tracks":["Architecture","System Design","RTE","OS","SysStack","Communication Stack","Safety Integration"],"question":"You have 15 minutes: present the AUTOSAR design and integration strategy for a brake-by-wire ECU.","minutes":7,"answer":["State vehicle function, item assumptions, timing, safety and availability needs.","Draw SWCs, ports, modes and ECU/network allocation.","Trace RTE, OS and communication data paths.","Add SysStack startup, supervision, diagnostics and persistence.","Explain BSW/MCAL configuration, generation, variants and supplier interfaces.","Close with FFI, E2E, fault reaction, validation, open risks and trade-offs."],"probes":["Power fails during braking.","The actuator command is duplicated.","A QM diagnostic routine overloads the CPU.","The MCAL safety assumption is unmet."],"refs":["End-to-end AUTOSAR Classic design","ISO 26262 lifecycle interface"]}
]
