[{"id":"E10-01","day":10,"tier":"Foundation","kind":"Concept","tracks":["Technical Management"],"question":"Differentiate technical vision, architecture strategy, product roadmap and delivery plan.","minutes":5,"answer":["Technical vision describes the desired future capability and engineering qualities.","Architecture strategy explains major structural choices and migration direction.","Product roadmap sequences customer and business outcomes.","Delivery plans commit teams, milestones and dependencies for near-term execution.","They must align but should not be collapsed into one document."],"probes":["Who owns each artifact?","How often should each change?","What happens when roadmap conflicts with architecture?"],"refs":["Technical strategy","Product planning"]},{"id":"E10-02","day":10,"tier":"Foundation","kind":"Concept","tracks":["Product Ownership"],"question":"What does strong product ownership mean for a common embedded feature?","minutes":5,"answer":["Own the customer and business outcome, not only backlog administration.","Understand architecture, constraints and lifecycle enough to make informed trade-offs.","Maintain vision, roadmap, acceptance and release content across products.","Balance commonality with legitimate product variation.","Create transparent priority decisions and close the loop with field results."],"probes":["How technical should the product owner be?","What authority is needed?","What is not the product owner's responsibility?"],"refs":["Product ownership","Common features"]},{"id":"E10-03","day":10,"tier":"Intermediate","kind":"Technical","tracks":["Technical Management","Platform Architecture"],"question":"How do you evaluate build, buy, reuse or partner options for an embedded platform capability?","minutes":7,"answer":["Define strategic differentiation and non-negotiable technical requirements.","Compare lifecycle cost, control, integration, security, support and exit options.","Validate vendor claims with representative prototypes and contract terms.","Assess internal capability and opportunity cost.","Choose an option with explicit assumptions, ownership and fallback."],"probes":["What makes a vendor lock-in acceptable?","How do safety or security obligations alter the choice?","Which proof should precede contract signature?"],"refs":["Build versus buy","Technology strategy"]},{"id":"E10-04","day":10,"tier":"Advanced","kind":"Technical","tracks":["Technical Management"],"question":"A global program has incompatible release cadences across hardware, platform, applications and cloud. Design the integration model.","minutes":7,"answer":["Define stable contracts and compatibility windows between domains.","Use independently releasable components where operationally safe.","Maintain integration trains for validated product compositions.","Automate cross-version contract and end-to-end tests.","Create escalation rules when one domain changes outside its compatibility promise."],"probes":["Who owns the product composition?","How are emergency fixes propagated?","What is the source of truth for compatibility?"],"refs":["Release train architecture","Global integration"]},{"id":"E10-05","day":10,"tier":"Advanced","kind":"Debugging","tracks":["Technical Management","Role Scenarios"],"question":"A critical field issue crosses five teams and no one owns the end-to-end path. What do you do in the first 24 hours?","minutes":7,"answer":["Appoint one incident lead and define customer impact and containment.","Create a shared timeline, system model and evidence repository.","Assign investigation branches by hypothesis, not organizational boundary.","Freeze harmful changes and preserve affected artifacts and telemetry.","Communicate decision cadence, owners and exit criteria to stakeholders."],"probes":["When do you roll back?","How do you avoid duplicate debugging?","When is executive escalation useful?"],"refs":["Incident leadership","System ownership"]},{"id":"E10-06","day":10,"tier":"Expert","kind":"Architecture","tracks":["Technical Management","Product Ownership"],"question":"Balance a scalable common platform with product teams that need fast local innovation.","minutes":7,"answer":["Define a small stable core and explicit experimentation edges.","Offer paved paths, self-service tooling and fast extension review.","Use adoption and lead-time data to improve the platform.","Allow bounded exceptions with expiry and migration plans.","Evolve common capabilities from proven repeated needs rather than speculative abstraction."],"probes":["How do you avoid central bottlenecks?","When should experiments graduate?","Who owns abandoned extensions?"],"refs":["Platform strategy","Innovation governance"]},{"id":"E10-07","day":10,"tier":"Advanced","kind":"Technical management","tracks":["Technical Management"],"question":"How do you lead senior engineers across multiple locations without becoming the decision bottleneck?","minutes":7,"answer":["Set context, principles, interfaces and decision rights.","Delegate domain decisions to accountable technical leaders.","Use written proposals and asynchronous review for global participation.","Reserve central escalation for cross-domain risk and irreversible choices.","Coach through outcomes and raise capability where decisions repeatedly fail."],"probes":["Which decisions stay central?","How is dissent recorded?","How do you measure leadership leverage?"],"refs":["Distributed engineering leadership","Decision systems"]},{"id":"E10-08","day":10,"tier":"Advanced","kind":"Product owner scenario","tracks":["Product Ownership","Role Scenarios"],"question":"Business stakeholders request ten features, but engineering capacity supports four. Produce a defensible priority.","minutes":7,"answer":["Connect each request to customer value, strategic objective, risk, dependency and effort range.","Identify must-do obligations and architecture enablers.","Compare sequencing and minimum useful slices.","Publish the selected four and the consequences of deferring the rest.","Revisit priorities when evidence changes, not when stakeholder volume increases."],"probes":["How are technical enablers represented?","What if estimates are uncertain?","How do you explain no to a major customer?"],"refs":["Portfolio prioritization","Business-engineering bridge"]},{"id":"E10-09","day":10,"tier":"Advanced","kind":"Engineering manager scenario","tracks":["Technical Management","Role Scenarios"],"question":"A high-performing team delivers features but creates burnout and fragile systems. How do you intervene?","minutes":7,"answer":["Make sustainability and product health explicit delivery outcomes.","Inspect workload, on-call, defect flow, ownership concentration and planning behavior.","Reduce work in progress and remove recurring operational toil.","Develop redundancy in expertise and protect recovery time.","Hold leaders accountable for durable output, not heroic throughput."],"probes":["What immediate commitments may need renegotiation?","How do you retain high performers?","Which signals show recovery?"],"refs":["People management","Sustainable engineering"]},{"id":"E10-10","day":10,"tier":"Expert","kind":"Board exercise","tracks":["Technical Management","Product Ownership","Role Scenarios"],"question":"Present a platform decision to executives: delay launch for architecture correction or ship with a managed exception.","minutes":7,"answer":["Describe customer outcome, failure risk and technical mechanism in plain language.","Present options with schedule, cost, lifecycle and product impact.","State evidence, uncertainties and reversible versus irreversible consequences.","Recommend one path with controls, owner and review date.","Explain how the decision affects roadmap, teams, customers and future platform capability."],"probes":["What new evidence would change your recommendation?","How is the exception prevented from becoming permanent?","Who accepts the residual risk?"],"refs":["Executive communication","Technical product leadership"]}]
