[{"id":"E09-01","day":9,"tier":"Foundation","kind":"Concept","tracks":["Performance & Reliability"],"question":"Explain latency, throughput, utilization, jitter, availability and reliability.","minutes":5,"answer":["Latency is elapsed time for an operation or path.","Throughput is completed work per unit time.","Utilization is resource occupancy and does not directly prove latency.","Jitter is variation in timing.","Availability is the proportion of time service is usable; reliability concerns failure-free operation over an interval.","Embedded requirements must define measurement points and operating conditions."],"probes":["Can high utilization be acceptable?","How can a reliable system be unavailable?","What percentile should be specified?"],"refs":["Performance metrics","Reliability"]},{"id":"E09-02","day":9,"tier":"Foundation","kind":"Concept","tracks":["Security & Quality"],"question":"Describe secure boot, measured boot, runtime isolation and key management as separate controls.","minutes":5,"answer":["Secure boot prevents unauthorized software from executing.","Measured boot records cryptographic identity for later attestation.","Runtime isolation limits damage between processes, partitions or devices.","Key management covers generation, storage, use, rotation and revocation.","These controls complement one another and require operational ownership."],"probes":["What does secure boot not prevent?","Where are device keys provisioned?","How is revocation handled offline?"],"refs":["Embedded security","Trust architecture"]},{"id":"E09-03","day":9,"tier":"Intermediate","kind":"Technical","tracks":["Performance & Reliability"],"question":"Build a performance budget for boot time, UI response and a control path.","minutes":7,"answer":["Define customer- or system-visible milestones.","Allocate budgets across boot stages, services and dependencies.","Separate cold, warm, update and degraded cases.","Include percentile or worst-case targets and resource headroom.","Instrument each boundary and fail CI or release gates on regression."],"probes":["Who owns shared boot time?","How are asynchronous milestones measured?","What margin is reserved?"],"refs":["Performance budgeting","Boot optimization"]},{"id":"E09-04","day":9,"tier":"Advanced","kind":"Technical","tracks":["Security & Quality","Connectivity & OTA"],"question":"A signed OTA image contains a known vulnerable library. Why did security controls fail?","minutes":7,"answer":["Authenticity proves origin and integrity, not absence of vulnerabilities.","The software bill of materials and vulnerability process failed to block or assess the component.","Release governance may lack exploitability and exposure analysis.","Signing authority and build provenance must be tied to approved evidence.","Remediation includes update, key/process review and prevention in dependency intake."],"probes":["Should the signing key be rotated?","How is exploitability assessed?","What if no fixed library exists?"],"refs":["Vulnerability management","Supply-chain security"]},{"id":"E09-05","day":9,"tier":"Advanced","kind":"Debugging","tracks":["Performance & Reliability"],"question":"A memory leak appears only after several days in the field. How do you diagnose it?","minutes":7,"answer":["Track allocations, ownership and process/resource growth over time.","Collect bounded field telemetry and trigger snapshots before exhaustion.","Differentiate heap leak, file descriptor, kernel object, graphics buffer and cache growth.","Reproduce with accelerated workload and fault injection.","Verify the fix through soak tests and trend-based release criteria."],"probes":["How do you collect data without worsening the leak?","What indicates fragmentation rather than leakage?","How is privacy preserved?"],"refs":["Long-duration testing","Field diagnostics"]},{"id":"E09-06","day":9,"tier":"Expert","kind":"Architecture","tracks":["Security & Quality","Platform Architecture"],"question":"Design a release pipeline for signed multi-component embedded software.","minutes":7,"answer":["Create reproducible builds with traceable source, configuration and tool versions.","Generate SBOM, test, static-analysis and vulnerability evidence per component.","Enforce compatibility and integration tests for the release composition.","Use controlled signing after approval, with protected keys and audit trails.","Publish immutable release metadata, rollback policy and field eligibility."],"probes":["Who may request signing?","How are emergency releases handled?","What is the unit of rollback?"],"refs":["Secure release engineering","Software supply chain"]},{"id":"E09-07","day":9,"tier":"Advanced","kind":"Technical management","tracks":["Technical Management","Security & Quality"],"question":"A release has one severe unresolved defect and strong commercial pressure. Lead the decision.","minutes":7,"answer":["State the failure mechanism, exposure, detectability, containment and customer impact.","Distinguish unknown risk from accepted residual risk.","Evaluate scope reduction, feature disablement, phased release and schedule change.","Require accountable decision owners and written rationale.","Do not substitute schedule pressure for evidence of acceptability."],"probes":["What if the defect is rare?","Who can override the release gate?","How is customer communication prepared?"],"refs":["Release governance","Risk decision"]},{"id":"E09-08","day":9,"tier":"Advanced","kind":"Product owner scenario","tracks":["Product Ownership","Role Scenarios"],"question":"A performance improvement requires dropping support for old hardware. How do you make the product call?","minutes":7,"answer":["Quantify customer population, support obligations and value of the improvement.","Explore profiles or staged deprecation before forcing one outcome.","Define migration, service and communication plans.","Account for platform complexity of maintaining both paths.","Publish a time-bound support policy with measurable exit criteria."],"probes":["When is dual support too costly?","What data proves customer impact?","How are strategic customers handled?"],"refs":["Lifecycle management","Product trade-off"]},{"id":"E09-09","day":9,"tier":"Advanced","kind":"Engineering manager scenario","tracks":["Technical Management","Role Scenarios"],"question":"Quality metrics look green, but field incidents are rising. What do you change?","minutes":7,"answer":["Audit whether metrics measure activities rather than escaped risk.","Link field incidents to missed tests, architecture weaknesses and process gaps.","Improve severity-weighted escape analysis and time-to-detect/contain.","Bring field telemetry and service data into planning.","Change incentives so teams own outcomes after release."],"probes":["Which green metrics may be misleading?","How do you avoid blaming test teams?","What cadence reviews field learning?"],"refs":["Quality leadership","Field feedback"]},{"id":"E09-10","day":9,"tier":"Expert","kind":"Board exercise","tracks":["Performance & Reliability","Security & Quality","Technical Management"],"question":"Prepare a release-readiness review for a shared embedded platform.","minutes":7,"answer":["Summarize scope, versions, variants and customer exposure.","Present requirement, test, performance, security, reliability and update evidence.","List deviations, residual risks, mitigations and owners.","Show operational readiness for deployment, rollback, support and incident response.","Make an explicit release recommendation and conditions."],"probes":["What evidence is weakest?","Which issue blocks all variants?","What is the rollback decision time?"],"refs":["Release readiness","Executive technical review"]}]
